topic_id,candidate_dimension,specific_topic_label,overlap_words,overlap_count,prob_words,frex_words,semantic_coherence,exclusivity
1,gentlemanly_respectability,gentlemanly respectability and social conduct,gentleman;lady;sir,3,"lady, mrs, miss, sir, young, dear, lord, friend, herself, man, sure, sister","miss, lady, elizabeth, fanny, helen, mrs, lord, anne, major, gentleman, cousin, ma'am",-22.8393890729697,9.59139648006337
2,imperial_frontier_adventure,imperial-frontier adventure and martial movement,sea;ship,2,"man, white, men, water, side, horse, tree, round, night, cried, stood, sea","boat, hazel, fang, ship, deck, dogs, buck, wolf, snow, sea, gabriel, hill",-37.0836675672356,8.80920500743142
3,none,unlabeled topic,,0,"door, night, voice, heard, hour, light, emily, passed, appeared, whose, sound, scene","emily, chamber, count, apartment, castle, marqui, convent, feature, repose, julia, scene, approached",-48.1360090855089,9.40933497452803
4,professional_commercial_breadwinner,professional-commercial breadwinner activity,dollar;money;work,3,"man, going, want, tom, street, money, door, new, put, right, girl, work","tom, joe, dollar, anthony, paul, cent, anna, car, bloom, alice, butler, big",-37.1431322038381,8.98664248776452
5,sentimental_romantic,sentimental-romantic masculinity,affection;feeling;happiness;love;sentiment,5,"myself, friend, letter, hope, however, herself, cried, man, love, sir, till, feeling","affection, conduct, happiness, esteem, madam, wholly, sentiment, error, attachment, situation, disposition, virtue",-28.2680691039785,8.40618209895111
6,aristocratic_chivalric,aristocratic-chivalric status and romance,highness;knight;prince;royal,4,"man, men, year, many, among, part, country, however, name, prince, people, english","prince, knight, nation, government, political, spain, jew, royal, saxon, citizen, highness, english",-48.4939515295719,8.37267571302239
7,domestic_paternal,domestic-paternal kinship and family feeling,child;father;home;mother,4,"love, mother, father, man, herself, felt, knew, margaret, poor, home, child, woman","margaret, guy, laura, mary, catherine, ellen, robert, loved, philip, love, charle, herbert",-37.5744561608864,9.35910771190978
